Hothouse US: Catastrophic Fires Spreading Smoke From the West; Five Cyclones To the East
In Praise of Public Debt
Myths and Lies About Poverty
US Poverty Measure Fails to Meet Government Standards of Reliability, Accuracy, Timeliness, and Objectivity
Finding My Students Over Zoom
'We Must Not Lose Focus': Louisville To Pay $12 Million to Family of Breonna Taylor, But Officers Not Yet Charged
A Persistent Eye in the Sky Coming to a City Near You?
Trump's Proposal to Further Expand Global Gag Rule Amid Pandemic Would Cut Off Healthcare Access to Millions, Rights Groups Warn
USDA and Meatpacking Industry Collaborated to Undermine Covid-19 Response, Documents Show
As West Burns, McConnell Says Filibuster Will Be Firewall On Progressive Legislation, Including Climate Action
Arctic Heat Wave: Block of Ice Twice as Big as Manhattan Breaks off Greenland’s Largest Ice Shelf, Goes Into Ocean
McConnell Vows to Be 'Firewall' Against Progress in Senate As Democrats Mull Eliminating Filibuster
Confused by Section 230? So Is Donald Trump
'It Is Past Time for Action': Ahead of Senate Antitrust Hearing, Groups Demand AGs Sue Google to End Monopoly Abuses
'A Matter of Life and Death': After 175 Years, Scientific American Backs Biden With Magazine's First-Ever Endorsement
Global Coalition Issues Liability 'Roadmap' to Make Big Corporate Polluters Pay for Planetary Harm
In Front of Today’s Senate Hearing, More than a Dozen Groups Urge Swift Enforcement Against Google to Put an End to Anti-Competitive Behavior
USDA, Meatpacking Industry Collaborated to Undermine COVID-19 Response, FOIA Docs Show
Groundbreaking Study Shows 'Deep Listening' Over 100 Times More Effective in Winning Undecided Voters Away From Trump
Schumer Demands Immediate Resignation of  Alex Azar for Being 'Subservient' to Trump as HHS Officials Distort Covid-19 Threat
Global Coalition Releases Liability Roadmap for Governments To Make Big Polluters Pay
'Where Will Everyone Go?' New Report Documents How Climate Migration Could Reshape US
New Zealand Becomes First Country in the World To Require Financial Sector To Report on Climate Risks
'$2.5 Trillion Theft': Study Shows Richest 1% of Americans Have Taken $50 Trillion From Bottom 90% in Recent Decades
UN Biodiversity Report Urges 8 Transitions Needed to Restore Essential Ecosystems Impacted by Humanity
Largest U.S. Investors Undermine Efforts To Halt Rainforest Destruction, New Report Finds
'Huge Victory for Net Neutrality': Top EU Court Rebuffs Zero-Rating Schemes
New UCS Analysis on Who is Most Exposed to Dangerous Smoke Days in Western US
It's Time to Repeal the President's License for Endless War
'Yet Another Alarm Bell': Ice Chunk Twice Size of Manhattan Breaks Off Greenland Glacier Amid Record Arctic Warming
Medicating Isolation
Bill Barr’s Deceitful Distortion of Jesse Jackson
'Forced Sterilization Is Genocide': Rights Groups Condemn ICE Amid Whistleblower's Allegations of Unwarranted Hysterectomies
With Less Than Two Months Until the Election, People’s Action Unveils Groundbreaking Study That Charts A Path to Defeat Trump
Roger Stone Coaches Trump on How to Stage an Election Coup
Senator Demands HHS Official Michael Caputo Be Fired for Deranged 'Sedition' Rant Against CDC Scientists
'Just Wildly, Blatantly Corrupt': Researcher Reveals DeJoy Donated $600,000 to Trump and GOP After Top USPS Job Opened
Former US-Backed Salvadoran Colonel Sentenced by Spanish Court to 133 Years in Prison for 1989 Jesuit Massacre
As the West Goes Up in Flames, Trump Couldn’t Care Less
In 'Devastating' Ruling, 9th Circuit Upholds Trump's Termination of Humanitarian Protections for Nearly 300,000 Migrants
Taking Aim at ExxonMobil, Connecticut Joins 'Fast-Growing Wave of Climate Lawsuits' Targeting Fossil Fuel Giants
It'll Start Getting Cooler, You Just Watch: Trump Spits Climate Denialism Right in California's Face
Connecticut Sues Exxon in Fast-Growing Wave of Climate Lawsuits
'This Is a Travesty': Climate Denier Who Has Argued in Favor of Fossil Fuel Emissions Named to Leadership Role at NOAA
'Outrageous': Sanders Blasts AstraZeneca for Raising Drug Prices Despite $1.2 Billion From Taxpayers for Covid-19 Vaccine
To Counter 'Misinformation Flowing From the Highest Levels,' ACLU Launches Voter Preparedness Campaign
Two Dozen Progress Groups to Congress: No Secret Spy Provisions in Must-Pass Legislation
Election Season is Here. Are You Ready to Vote?
Blood All Over: Physicians' Group Identifies 115 Head Injuries Caused By So-Called Less-Lethal Projectiles
Millions of People Demand Congressional Action on COVID-19 Relief
New York Senate Attacks the American Monopoly Crisis
Bye Bye, Big Oil? BP Admits Demand May Have Already Peaked, Predicts Growth of Renewable Energy
Trump Campaign Continues To Use Antisemitic Dogwhistles
To Block Trump's Gutting of Methane Regulation, Coalition of State and Local Governments Sues EPA
DRUG PRICING: Trump Caves to Drug Industry; Long-Delayed Executive Order Another Broken Promise to Patients
Leave Patriot Act out of Continuing Resolution: ACLU, Demand Progress, FreedomWorks, NAACP, and More
How Should America Respond When Its President Commits Negligent Homicide?
Free Chicken: Alexander Vindman on Trump, Stone and All the Other Deadly Useful Idiots
Species in Peril: Loss, Love and Protection
Trump Accused of 'Negligent Homicide' for Gathering Thousands of Maskless Supporters at Indoor Nevada Campaign Rally
A Thank You Letter From Coronavirus to My Enablers in the United States
Beyond Attacking Trump, Sanders Says Biden Campaign Must 'Give People a Reason to Vote for Joe'
ACLU Launches Campaign To Encourage Voting and Educate on Vote by Mail
Investors Who Manage $47 Trillion Pressure Top Polluters to Pursue Transition to Net-Zero Emissions
New Study Finds Planet Heading Toward Temperature Threshold Not Seen in 34 Million Years
Over 50 Organizations/Groups to Protest the UAE and Bahrain Normalization with Israel During Deal Signing at the White House
'We're With You': ACLU, Press Freedom Advocates Denounce Attack on Journalist by LA Sheriff's Deputies
National (In)Security and the Pentagon Budget
'No One Should Be Fooled': Trump Executive Order on Drug Prices Denounced as Election Year Charade
Why Don't People Call You a Genius? You Don't Have a Billion Dollars
Sanders Delivers Message to Lawmakers Who Claim US Can't Afford Green New Deal: Climate Catastrophe Is 'Much More Expensive'
The Loudest Voices Make the Greatest Changes
Is BP Finally Committing to Ambitious Climate Action—or About to Fool Us Twice? Five Things to Look For in Its Climate Strategy
How a US Army Whistleblower Revealed 'the Apparatus of a Police State'
Citizen Musk
'There Has to Be Retribution': Trump Openly Endorses Extrajudicial Killings of Suspects by Law Enforcement
Warning 'Patently False' Information 'Will Sow Confusion,' Federal Judge Blocks Postal Service From Sending Mailers to Colorado Voters
'A Huge Slap in the Face': Family of Worker Who Died of Covid Slams Trump OSHA Over Paltry $15,600 Fine Against Meat Company
With Wildfires Tearing Through the West, Biden Slams Trump Denial and Calls Climate Crisis an 'Imminent, Existential Threat'
Condemning 'Attempt at Voter Suppression,' Colorado Sues DeJoy Over Misleading Postal Service Mailers
WATCH: Bernie Sanders Hosts 'Fighting for Justice in Michigan' Town Hall With Rashida Tlaib
'Do Not Do What the President Directs,' Warns North Carolina AG as Trump—Once Again—Urges Residents to Commit Felony by Voting Twice
Climate Emergency Overdrive: Our Age of Compound Disasters as 10% of Oregon Is Evacuated, California Burns, and Louisiana Sinks
'Beyond Suspect': States Warn DeJoy-Led Postal Service Is Sending Misinformation About Voting to Millions of Americans
Trump's Broken Promises to His Voters—He Didn't Deliver!
Trump Plays Both Sides Against the Middle
Pandemic in the Pacific: US Military Bases Are Hot Spots for More Than Just Covid-19—They Also Make Island Territories Targets for Climate Disasters
Manufacturing Disgrace: Reuters Distorts Chevron v. Donziger
Watchdog Group Files FEC Complaint Against DeJoy for 'Orchestrating an Illegal Straw Donor Scheme to Help Elect Republicans'
'Downright Criminal': Leaked Emails Reveal Effort by Trump Aides to Censor and Alter CDC Covid Reports Behind Closed Doors
Bernie-Inspired Organizers and Rhode Island Voters Deliver 'Crystal Clear Message' With Progressive Primary Wave
With Integrity of Election at Stake, 14 States Demand Injunction to Stop DeJoy's Sabotage of US Postal Service, Mail-In Voting
Trump’s ‘War On Journalism’ Takes Centerstage At Julian Assange’s Extradition Hearing
UN: Israeli Demolition of Palestinian Homes Increases Despite Pandemic
ICE Fails to Respond to Reports of Miami Detention Facility Feeding Pork to Muslims
Fauci Warns Pre-Pandemic Normalcy Not Likely Until 'Well Into' or 'Towards the End of 2021'
Federal Appeals Court Affirms Wealth-Based Barriers to Voting
Appeals Court Leaves in Place Florida’s Pay-to-Vote Scheme
This Is a Climate Emergency. We Need More Than Half-Measures from Democrats.
'Reckless, Violent, Massacre' of 570 Wolves and Wolf Pups in Idaho Bolsters Alarm Over Trump Attack on Species Protections
Idaho Documents Reveal Weeks-old Wolf Pups Among 570 Maimed, Slaughtered Wolves
Senator McConnell’s Not-So-Skinny Relief Package For Coal and Mining Special Interests Failed For A Reason
'Incredibly Dark Day for Voting Rights': With Support of Trump Judges, Federal Court Upholds Florida Poll Tax Weeks Before Election
A Court Just Slammed the Guantánamo Gate Shut
NYT's Krugman Pilloried on 9/11 Anniversary for Claiming No 'Mass Outbreak of Anti-Muslim Sentiment' in US After 2001 Attacks
The Direct Line From Portland To Authoritarian Crackdowns Around the World
Fires Ravaging US West a 'Bellwether of the Future,' Says Oregon Governor as Half a Million Residents Evacuate
Survey Shows Nearly Half in US Suffering Serious Economic Hardship—and Situation 'Going to Get Worse'
Police Encounters During Mental Health Crises Don’t Have to Be Violent
As NFL Players Offer Show of Unity, Booing by Fans Shows Objections to Protests 'Was Always About Perpetuating White Supremacy'
New UN Report Recommends ICC Investigate Possible War Crimes by All Sides—Including US-Backed Coalition—in Yemen
Teacher Deaths and College-Town Outbreaks Deepen Concern Over Covid-19 Risks Stirred by School Reopenings
Federal Court Blocks 'Nakedly Partisan' Trump Effort to Exclude Undocumented Immigrants From Census
As Fires Engulf West, Democrats Not Running on Trump Climate Failures Accused of 'Political Malpractice'
How Trump Will Try to Win—or Steal—the Election
Food Need Very High Compared to Pre-Pandemic Levels, Making Relief Imperative
Sanders Slams Republican Senate for Happily Approving $740 Billion for Pentagon While Doing 'Nothing' to Address Covid Crisis
It's a Superspreader Event: Few Masks in Sight at Packed Trump Campaign Rally in Michigan
'Appalling Betrayal': New Report Details Dozens of Trump Rollbacks Perpetrated Under Cover of Covid-19
Political Showmanship Won't Support Small Businesses
Is Trump a Murderer?
States Already Out of Unemployment Cash Helps Prove Much-Predicted Failure of Trump's Executive Action on Covid-19 Relief
After 'Disgraceful' GOP Coronavirus Package Defeated, Progressives Demand McConnell 'Get Serious' About Relief
Failed Mcconnell Bill Cared More About Lawsuits Than Keeping Kids Safe
'Mandatory for Anyone With an Ounce of Awareness': Climate Coalition Calls on New York State to Divest From Fossil Fuels
Senate’s Inadequate Relief Bill Failed
Nothing To See Here, Just the Attorney General Condoning Extra-Judicial Killings To Save Us From Imaginary Violent Mobs
Trump Has Been Silent On the Western Wildfires For Nearly Three Weeks
New UCS Web Feature Visualizes Ways Climate Change is Driving Wildfires, Experts Also Available
Young Washington Plaintiffs Argue Appeal in Constitutional Climate Change Case
The American West Is Burning But Trump Hasn't Mentioned Historic Wildfires in 'Any Way, Shape, or Form' for Nearly 3 Weeks
McConnell’s Skinny Bill Is Dead. Can Serious Negotiations Begin Now?
We Must Take The Vaccine Industry Into Public Ownership To Ensure Its Products Are Available To All
Fact Checking the Fact Checkers: Trump Does Indeed Plan To Destroy Social Security
'Where Are the Tests?' US Schools Reopen Amid Worrying Lack of Covid-19 Resources for Students, Educators
Faced With Rising Seas and Other Consequences of Climate Crisis, Low-Lying Delaware Sues 31 Fossil Fuel Companies
Stark New Visualizations Show How Climate Change Is Fueling Worsening Western Wildfires
The Evidence is Clear: The US Public Wants Science-Based Policies for COVID-19
'What a Healthy Democracy Should Look Like': Connecticut Small-Dollar Campaign Program a Model for Restoring Power to the People
Want to Know What a Worker's Life Is Worth in America? Trump's OSHA Fines Meat Company Just $13,494 for Infecting 1,294 Employees With Covid
THRIVE Agenda Creates Millions of New Jobs While Addressing Intersecting Crises of Climate Change, Racial Injustice, and Economic Inequity
These Big City Mayors Want Green Stimulus Spending to Counter Covid-19
'Autocrats Deliver?' US Joins Brazil and Hungary as Only Countries Where Quality of Life Is Getting Worse, Social Progress Index Finds
'Green New Deal or the Blood Red Apocalypse. Your Choice': Dems Urged to Embrace Bold Climate Action as West Burns
Listen Quick, There's a Fire
Lawmakers, Progressive Coalition Unveil Framework to Create 'Thriving' Fair and Green Economy in Pandemic Recovery
Nobody Expected We Would Pay Such a Steep Price for Electing a Mentally Ill Criminal as President—Can We Recover?
Former NSA Chief Keith Alexander—Who Lied About Mass Surveillance—Joins Amazon's Board
The Presidential Election: 'A 200-Pound Sack of Concrete' vs. 'The Orange Menace'
'Nature Is Unraveling': New WWF Report Reveals 'Alarming' 68% Plummet in Wildlife Populations Worldwide Since 1970
Six Months After Emergency Declared, Trump Has Repealed More Than 30 Public Protections
'One of Many Reasons Why Single Payer Matters': For-Profit Insurers Hitting People With 'Illegal' Bills for Covid Tests
The Coronavirus Pandemic Poses Major Challenges To U.S. Students and Their Teachers—and Exacerbates Existing Education Inequities
Standing up To Trump . . . and Biden
Survey Reveals Overwhelming Demand for European Central Bank To Act on Climate Crisis
Victory for Mail-In Voting in Tennessee as Federal Judge Rules Against GOP-Enacted State Law
'Every City Council Should Follow Suit': Portland, Oregon Becomes First US City to Ban Corporate Use of Facial Recognition Surveillance
'Dereliction of Duty': Outrage as USPS Board Issues Gushing Praise for DeJoy Amid Mail Slowdowns, Medicine Delays, and Straw-Donor Scandal
Victory! Court Orders Tennessee to Allow Citizens to Vote by Mail
Congress Urged to Provide Immediate Pandemic Relief to U.S Food, Farm, Fish Systems
New Legislation Is the Latest Attempt by Trump and His Congressional Allies to Bend Online Platforms to Their Political Will
Emails Show How Trump Official at HHS Tried to Get Fauci to Downplay Covid-19 Threat to School Children
Trump Lied, 190,000 - A 9/11 Attack Every Day For 2 Months - Died
'Reckless Homicide': Audio Tapes Reveal Trump Knew Covid-19 Was 'Deadly Stuff' for Months While Publicly Downplaying Threat
Lambda Legal Blasts Trump’s SCOTUS Shortlist Filled with Anti-LGBT and Extremist Judges
Reimagining School Safety: New Institute for Policy Studies Report Shows How Much It Costs Communities to Have Cops in Schools
Top Republican Social Security Expert: Trump’s Defunding of Social Security Opens the Door to Privatization
CCI Statement on Charleston Climate Lawsuit
Public Citizen Report: Trump’s Land Privatization Was Decades in the Making By Right-Wing Groups, Corporations
With Half a Million Kids Infected, Where are the Tests?
It's going to require radical transparency to give Americans assurance to take COVID-19 vaccines
Pelosi pressures Senate, White House: House is staying in session until COVID-19 relief is done
More Republicans look to join the House 'What coronavirus threat?' caucus
Biden and Trump campaigns spend heavily in fight for Florida's 29 electoral votes
Trump team not pleased that nation's employers aren't down with his plan to destroy Social Security
Caputo's job said to be in jeopardy after off-the-rails Facebook attacks on government scientists
Breonna Taylor's family to receive $12 million settlement, but officers still have not been charged
The polls are out, and guess what they say about Trump's 'law and order' racial dog whistles
House, Senate Republican ads still a no-go zone for Trump
Armed vigilantes set up rural checkpoints in Oregon as ‘antifa fires’ hoax inflames social media
Calls for CNBC host’s resignation after he used a misogynistic slur live on-air to Nancy Pelosi
South Dakota AG said he thought he hit a deer late on Saturday—the next day, he found a man's body
Peace Through Weapons Sales to the UAE
'Reducing Troops Not the Same as Ending Wars': Peace Activists Say Trump Drawdown in Iraq Not Nearly Enough
With 'Irreparable Damage' Looming, 15 State AGs File Suit to Block Trump From Fossil Fuel Assault on Arctic Refuge
While Trump Commission Warns of Climate Risk to Financial System, Recommendations 'Fall Short of Direct, Immediate Action' Required
The US War on Terror Has Created at Least 37 Million Refugees
In South Dakota, a Young Labor Leader Wants to Rebuild a Culture of Solidarity
What Canada’s Social Democrats Must Do
The Only Thing You Need to Read About the Inane <cite>Cuties</cite> Controversy
Joe Biden Is Severely Hurting His Chances of Beating Donald Trump
This Vermont Gubernatorial Nominee Is Showing How Successful Third Parties Are Possible
How Eastern Bloc Architects Shaped Cities Across the Third World
Donald Trump Has Added Trillions to the US Military Budget. Joe Biden Wants to Spend Even More.
Uber and Lyft Are Trying to Cancel Pro-Worker Activism
Chris Coons Is Big Pharma’s Man in Washington
Uber and Lyft Drivers&#8217; Fight Against Independent Contractor Status Isn&#8217;t Going Away
Donald Trump Has Declared War on the Climate Movement
No, the European Union Shouldn’t Try to Become a New Superpower
The New York City Left Could Get a Chance to Define the Post-COVID City
The Working Class Is the Vast Majority of Society
No More Excuses. It’s Time to Fight for a Left Program in Canada.
Save the USPS, Defend Democracy
Workers and Consumers Have Forced Republican Governors to Mandate Masks
Democrats Aren’t Entitled to the Latino Vote
Without Us, the School Would Fall Apart
Pandemic Profiteering: Amazon Caught Price Gouging as Jeff Bezos's Wealth Soared to $200 Billion
Colonization Made California a Tinderbox: Why Indigenous Land Stewardship Would Help Combat Climate Fires
Mass Voter Disenfranchisement: GOP Ramps Up Assault on Voting Rights Across U.S. Ahead of Election
Headlines for September 15, 2020
Trump Is Criminality Personified: Rev. William Barber on Protecting the Vote & Mobilizing the Poor
These Are Climate Fires: Oregon Firefighter Ecologist Says Devastating Blazes Are a Wake-Up Call
Pandemic, Wildfires & Heat Wave: Undocumented Farmworkers Face Triple Threat as West Coast Burns
Headlines for September 14, 2020
What Went Wrong with AstraZeneca's Vaccine Trial? CEO Only Shares Details with Investors
Barbara Smith: The U.S. Functions with White Supremacy as Its Engine. Here's How We Dismantle It
Costs of War: After 9/11 Attacks, U.S. Wars Displaced at Least 37 Million People Around the World
Headlines for September 11, 2020
Democratic Public Health: Big Pharma Relies on Developing World While Limiting Access to Treatment
COVID Vaccine Trials Seek Black & Latinx Participants, But History of Medical Apartheid Sows Mistrust
This Is Climate Change: West Coast Fires Scorch Millions of Acres & Blot Out the Sun
Headlines for September 10, 2020
Unforgetting: Roberto Lovato's Memoir Links U.S. Military in Central America to Migration Crisis
175 Years in a U.S. Prison? Extradition Trial of WikiLeaks Founder Julian Assange Begins in London
Headlines for September  9, 2020
Quid Pro Quo: Did Trump Help Kill Anti-Corruption Probe in Guatemala to Aid Reelection Bid?
Loss of the Entire Community: 6 Months Later, Trauma of Breonna Taylor's Killing Remains
The Police Can't Be Judge, Jury & Executioner: Filmmaker Yoruba Richen on Killing of Breonna Taylor
Headlines for September  8, 2020
Freedom Struggle: Angela Davis on Calls to Defund Police, Racism & Capitalism, and the 2020 Election
Cornel West & Ben Jealous on Whether Progressives Can Push Joe Biden Leftward If He Defeats Trump
We Are the 99%: Occupy Wall Street Activist & Author David Graeber, Dead at 59, in His Own Words
Death Is on the Ballot: Lessons for the US, 50 Years After Allende's Socialist Revolution in Chile
How Fascism Works: Trump's Law & Order Is Lawlessness, Fueling Racist Violence & Chaos
Headlines for September  4, 2020
Healing Needs to Happen: Kenosha Native Rep. Mark Pocan on Trump's Visit & the U.S. Policing Problem
Putin Can't Afford to See Belarus Fall as Protests Calling for Lukashenko's Ouster Enter 4th Week
Where Is the Accountability? 23 Deaths at Fort Hood Prompt Commander's Removal, New Investigation
Headlines for September  3, 2020
Kenosha Journalist Quits over Coverage of Jacob Blake Protests, Citing Ignorance, Lack of Diversity
We Feel Betrayed: NYC Reaches Deal with Teachers to Reopen Schools & Avert Strike, But Is It Safe?
The End of Oil? Pandemic Adds to Fossil Fuel Glut, But COVID-19 Relief Money Flows to Oil Industry
Headlines for September  2, 2020
‘We’ve all started calling it the Senseless ’
America’s ring of fire
‘We sent 500 tests. They don’t answer calls’: Inside ICE’s coronavirus testing disaster
Where ICE reports COVID-19 cases
Work for the U.S. Postal Service? We want to hear from you.
How Donald Trump took down the Robert Mueller of Latin America
The Robert Mueller of Latin America
‘No matter what we did, we just couldn’t catch up.’
The refuge revealed
Many US workplaces required to report injuries flouted new Labor Department rule
For Palestinians and Their Supporters, Arab-Israeli Pacts Are 'A Stab in The Back' Amid Ongoing Oppression
Health Care Workers and COVID 19
Imagining A New World on the Other Side of the Pandemic
Senator Dumped Up to $1.7 Million of Stock After Reassuring Public About Coronavirus Preparedness
Social Distancing USA
If Trump Declares Martial Law Due to Coronavirus, Can He Suspend the Election?
Not Giving Up on Happiness: Care of the Self and Well-Being in a Plague Year
The Dem Primary is Over, and We Need Bernie Sanders to Lead on Health Care From the Senate
These Are the 51 GOP Senators Who Just Voted Against Expanding Paid Sick Leave to Protect Americans
Quarantine Bridge
Elections May Have to Change During the Coronavirus Outbreak. Here’s How.
Forest fires as threats to the suburbs take center stage in presidential race
Pro-Trump student group building a secret ‘troll farm’ designed to get around social media moderation: report
‘Barr has gone off the rails’: The attorney general’s new comments are stunning even his fiercest critics
Madonna to direct own biopic
Why Trump really could end up ‘behind bars’ if he loses
Attorney general who killed man with his car while reporting hitting a deer now says ‘I discovered the body’
WATCH: Wolf Blitzer confronts Kushner about Trump retweeting ‘disgusting’ Biden conspiracy theory
Man behind wheel of self-driving Uber car charged with negligent homicide for running over woman
Jared Kushner shredded after claim coronavirus mortality rate is ‘good’ and dismissing mask protests
Betsy DeVos vows to require standardized tests again: 4 questions answered
Oracle ‘very close’ to deal on TikTok: Trump
Mitch McConnell vows to be ‘firewall’ against progress in Senate as Democrats mull eliminating filibuster
Republican acknowledges the Senate Foreign Relations Committee is scheming to help Trump win
USDA and meatpacking industry collaborated to undermine COVID-19 response, documents show
Democrat shocked by polling place plastered with Trump signs; demands Election Commission fix
Democratic opponent calls Lindsey Graham’s bluff
Inspector General refuses to investigate if acting DHS Secretary Chad Wolf is serving illegally after judge says ‘likely’
Minorities made up 78 percent of US COVID-19 pediatric deaths: study
Trump randomly blames China after he’s asked if he believes in global warming
CNN’s Jake Tapper blasts Trump for spreading a ‘deranged and disgusting lie about Joe Biden’
Ohio Republican may be most unpopular politician in history — and is likely to be re-elected in November
Republicans drowned out ill veterans begging for help with their ‘Commitment to America’ rally
‘$2.5 trillion theft’: Study shows richest 1 percent of Americans have taken $50 trillion from bottom 90 percent in recent decades
Crime fell as coronavirus swept US: FBI
Here’s why the US presidential election will probably be much closer than the polls suggest
Demons of the deep state: how evangelicals and conspiracy theories combine in Trump’s America
HHS spokesperson Michael Caputo weighing medical leave or resignation after issuing paranoid armed insurrection warning: report
‘Screaming matches’ erupted in the Trump administration as HHS sought to override FDA on COVID tests: report
Replica of burned Melania statue unveiled in Slovenia
Trump’s big lie reveals a truth: Right-wing science denial was never about ignorance — just cruelty
An ICE whistleblower’s horrifying account of forced sterilization raises fears of eugenics and genocide
CNBC host called on to resign after he used a misogynistic slur live on-air to Nancy Pelosi
